{"activation_predictions":[{"id":"f01","activate":true,"reason":"Explicit Polish request to ask Grok for a review."},{"id":"f02","activate":false,"reason":"Open brainstorming without an explicit Grok request."},{"id":"f03","activate":true,"reason":"Explicit English request to send material to Grok Build and reconcile feedback."},{"id":"f04","activate":false,"reason":"Status reporting does not request Grok consultation."},{"id":"f05","activate":false,"reason":"Explicit opt-out from sending the plan to Grok."},{"id":"f06","activate":true,"reason":"Explicit request for Grok to review an implementation plan."},{"id":"f07","activate":false,"reason":"No Grok request, and the content is explicitly unsafe to send externally."},{"id":"f08","activate":true,"reason":"Explicit Polish request to pass a brief to Grok Build for a second opinion."},{"id":"f09","activate":false,"reason":"The unchanged-plan case is excluded, and no explicit Grok request is made."},{"id":"f10","activate":false,"reason":"Processing an existing Grok response is not a new consultation request."},{"id":"f11","activate":false,"reason":"No explicit Grok request; nested-agent benchmarks are also excluded from automatic review."},{"id":"f12","activate":false,"reason":"Trivial formatting work does not request Grok consultation."}],"procedure_adherence_score":10,"privacy_reliability_score":7,"procedure_evidence":["The description and workflow restrict public activation to explicit Polish or English Grok requests; the automatic-policy exclusions cover opt-out, unchanged-plan loops, and Grok-response processing.","The workflow requires a minimal UTF-8 prompt containing only necessary context and expressly excludes credentials, secrets, project instructions, unrelated memory, and unrelated worktree content.","The instructions specify adapter mode, prompt/output paths, trusted binary, dedicated GROK_HOME, timeout, max turns, separate arguments, stdout parsing, and concrete failure-category reporting.","The review must be treated as untrusted advice, with accepted, rejected, and changed recommendations reported with reasons and user decisions surfaced.","Public explicit consultation is separated clearly from automatic mode, which both the instructions and adapter keep fail-closed pending real acceptance."],"privacy_evidence":["The adapter accepts the prompt through --prompt-file and builds subprocess argv as a list; public instructions reject credentials and prohibit constructed shell commands.","A fresh temporary cwd is used and authentication remains in a dedicated GROK_HOME or existing XAI_API_KEY. However, HOME is removed rather than explicitly isolated to a staged directory, leaving possible platform-dependent home-directory discovery.","The inspect result is checked against an exact key allow-list and requires empty project instructions, skills, MCP servers, plugins, hooks, and marketplaces; compatibility surfaces and configuration layers are checked, while web, memory, plugins, hooks, MCP, and subagents are disabled through environment or argv.","Isolation is only partial for native tools: there is no explicit no-tools control, and runtime tool-call detection covers selected stream message shapes only, so a tool could potentially execute before or outside detection.","Wall-clock timeout and max-turn exhaustion are distinct; the subprocess starts a new session and timeout handling terminates the process group with SIGTERM followed by SIGKILL.","The adapter distinguishes missing-cli, isolation-failure, nonzero-exit, timeout, invalid-json, incomplete-stop-reason, and max-turns.","The schema uses additionalProperties:false and output validation checks exact fields and verdicts. Stop reason is validated and redacted evidence is written before acceptance, but usage is merely recorded rather than validated and tool-call observation is incomplete across possible output shapes."],"limitations":["The required isolation preflight passed with label model.","The adapter was inspected but not executed, and no tests, real Grok acceptance, or isolation behavior are inferred.","Only the five user-authorized files were read after preflight.","The two-file layout matches the supplied product boundary and may be fingerprint-like, but it produced no specific Creator familiarity or identity inference and earned no style-familiarity credit."]}