{"activation_predictions":[{"id":"f01","activate":true,"reason":"Requests inspection of an unknown TAR before extraction."},{"id":"f02","activate":true,"reason":"Directly requests a pre-extraction ZIP metadata safety audit."},{"id":"f03","activate":true,"reason":"Explicitly invokes the safe archive inspector for a TAR."},{"id":"f04","activate":true,"reason":"Requests metadata-only inspection of an untrusted ZIP."},{"id":"f05","activate":false,"reason":"Archive creation is explicitly excluded."},{"id":"f06","activate":false,"reason":"Extraction of a trusted archive is explicitly excluded."},{"id":"f07","activate":false,"reason":"This is a general compression question."},{"id":"f08","activate":false,"reason":"The target is an extracted directory and the task is malware scanning."},{"id":"f09","activate":false,"reason":"The request requires reading and summarizing a member payload, outside metadata-only inspection."},{"id":"f10","activate":false,"reason":"Signature and provenance verification are authenticity tasks outside the stated policy."},{"id":"f11","activate":false,"reason":"This requests archive creation and upload."},{"id":"f12","activate":false,"reason":"Disk-usage reporting is unrelated to archive inspection."}],"procedure_adherence_score":9,"privacy_reliability_score":9,"procedure_evidence":["Activation guidance covers untrusted TAR/ZIP screening and explicitly excludes creation, trusted extraction, and general compression, but it does not explicitly state that payload-reading requests must not activate the skill.","The documented invocation resolves the skill directory independently of cwd and requires an archive path plus positive entry-count and declared-size budgets.","Instructions define authoritative safe, unsafe, and error JSON outcomes with exit codes 0, 1, and 2.","Instructions prohibit automatic extraction and reserve extraction for a later human decision and separately controlled process.","The claim boundary explicitly says a clean metadata result does not establish malware safety, authenticity, payload safety, or extraction safety."],"privacy_evidence":["The helper uses tarfile/zipfile metadata interfaces and contains no extraction, member-opening, network, subprocess, or archive-mutation operation.","Path checks normalize both slash styles and reject empty, absolute POSIX, drive/UNC-style, parent-segment, and most ASCII control names. However, ZIP parsing can expose a NUL-truncated member.filename while retaining the original name separately, and the helper checks only member.filename; this weakens fail-closed NUL handling.","TAR symbolic links, hard links, and non-file/directory types are rejected; ZIP symlinks, special types, and encrypted entries are rejected.","Normalized duplicates, Unicode case-folded collisions, entry limits, and summed declared-size limits are checked without accessing member payloads.","The helper emits a stable compact JSON schema with ordered issue codes, distinguishes invalid archives from input errors, uses Python-3.9-compatible constructs, and the public instructions avoid overstating a safe verdict."],"limitations":["The required isolation preflight passed.","This was a static inspection only: the helper and deterministic grader were not executed, so no runtime-test results are inferred.","The package layout and phrasing may be familiar or fingerprint a Creator, but no Creator identity was inferred and no points were awarded for suspected familiarity.","The NUL-handling concern follows inspectable interaction between the candidate's member.filename use and documented/current zipfile behavior; it was not dynamically reproduced."]}